{
  "$schema": "./scene.schema.json",
  "schemaVersion": 1,
  "id": "water",
  "displayName": "线稿海域",
  "description": "低多边形线稿、交错起伏与客户端浮力演示构成的纸绘海域。",
  "capacity": 8,
  "sceneComponents": [],
  "environment": {
    "weather": { "initial": "sunny" },
    "dayNight": {
      "enabled": true,
      "startHour": 16.9,
      "dayLengthSeconds": 1500
    }
  },
  "actors": [
    {
      "id": "demo-raft-01",
      "archetype": "raft",
      "localTransform": { "position": [0, 0, 0], "yaw": 0.24 }
    },
    {
      "id": "raft-deck-prop-01",
      "archetype": "deck-prop",
      "parentActorId": "demo-raft-01",
      "localTransform": { "position": [0.72, 0.62, -0.55], "yaw": -0.1 }
    },
    {
      "id": "cargo-crate-01",
      "archetype": "cargo-crate",
      "localTransform": { "position": [3, 0, 1.5], "yaw": -0.18 }
    },
    {
      "id": "cargo-crate-02",
      "archetype": "cargo-crate",
      "localTransform": { "position": [-4.5, 0, -2.5], "yaw": 0.42 }
    },
    {
      "id": "reef-01",
      "archetype": "reef",
      "localTransform": { "position": [1.2, -0.45, 5.2], "yaw": 0.31 }
    }
  ],
  "renderer": {
    "type": "line-art",
    "background": "#f5f2e9",
    "fog": { "color": "#f5f2e9", "near": 34, "far": 82 },
    "content": { "ground": false, "trees": false, "grass": false, "ocean": true },
    "palette": {
      "ground": "#e1d4b4",
      "grass": "#c1d7a6",
      "treeTrunk": "#d6bea3",
      "treeNeedles": "#cbdcbc"
    },
    "ocean": {
      "size": 112,
      "segments": 28,
      "waveHeight": 0.32,
      "waveSpeed": 0.82,
      "noiseScale": 0.085,
      "noiseStrength": 1.15,
      "interlaceStrength": 0.42,
      "surfaceColor": "#c9e6f2",
      "secondaryColor": "#b7dbea",
      "gridLineColor": "#5f8195",
      "gridLineOpacity": 0.25
    }
  },
  "gameplay": {
    "playerActor": { "archetype": "player-slime" },
    "bounds": { "minimumX": -48, "maximumX": 48, "minimumZ": -48, "maximumZ": 48 },
    "spawn": { "centerX": 0, "centerZ": 0, "radius": 3, "slots": 8 },
    "water": { "seaLevel": 0 }
  },
  "camera": {
    "mode": "fly",
    "position": [10, 6.5, 16],
    "yaw": -0.45,
    "pitch": -0.24,
    "moveSpeed": 9
  }
}
